dialogue_id	turn_id	speaker	utterance	goal_domains
1022	0	USER	東京に行くんですが、無料駐車場のあるショッピングモールを探しています。	general,shopping,attraction,weather
1022	1	SYSTEM	かしこまりました。では、KITTE丸の内はいかがでしょうか。	general,shopping,attraction,weather
1022	2	USER	そこの住所と最寄り駅、定休日を教えてもらえますか？	general,shopping,attraction,weather
1022	3	SYSTEM	住所は東京都千代田区丸の内2丁目7-2でございます。最寄り駅は東京駅で、定休日は無しでございます。	general,shopping,attraction,weather
1022	4	USER	ありがとうございます。あと、無料Wi-Fiが利用できる観光名所も探していて、自然のある場所や公園がいいのですが。	general,shopping,attraction,weather
1022	5	SYSTEM	申し訳ございません。その条件で案内できるところがございませんでした。	general,shopping,attraction,weather
1022	6	USER	わかりました。無料Wi-Fiが利用できればどこでもいいです。どこかありますか？	general,shopping,attraction,weather
1022	7	SYSTEM	ではサンシャイン水族館はいかがでしょうか。	general,shopping,attraction,weather
1022	8	USER	ありがとうございます。そこは近くの駅からどのくらいで行けますでしょうか？	general,shopping,attraction,weather
1022	9	SYSTEM	池袋駅から徒歩で8分、東池袋駅から徒歩で3分でございます。	general,shopping,attraction,weather
1022	10	USER	ありがとうございます。11月11日の文京区の最高気温と、天気も教えてもらえないでしょうか？	general,shopping,attraction,weather
1022	11	SYSTEM	最高気温は16度、天気は曇時々晴れでございます。	general,shopping,attraction,weather
1022	12	USER	ありがとうございます。これで大丈夫です。	general,shopping,attraction,weather
1022	13	SYSTEM	承知しました。ありがとうございました。	general,shopping,attraction,weather
