dialogue_id	turn_id	speaker	utterance	goal_domains
1139	0	USER	名古屋への旅行を計画中なのですが。尾頭橋駅近くで医薬品・化粧品の買い物がしたいです。駐車場が無料で探してもらえますか。	general,shopping,restaurant,weather
1139	1	SYSTEM	承知しました。ゲンキー富船店がございます。何かご案内致しましょうか？	general,shopping,restaurant,weather
1139	2	USER	エリアはどこになりますか？	general,shopping,restaurant,weather
1139	3	SYSTEM	はい、エリアは中川区になります。他にご案内できることはございますか？	general,shopping,restaurant,weather
1139	4	USER	飲食店も教えて下さい。駐車場が無料で高めのお店が希望です。	general,shopping,restaurant,weather
1139	5	SYSTEM	承知しました。では、魚鉄はいかがでしょう？何かご案内致しましょうか？	general,shopping,restaurant,weather
1139	6	USER	最寄り駅，料金情報を教えて下さい。	general,shopping,restaurant,weather
1139	7	SYSTEM	はい、最寄り駅は志賀本通駅、駅からの所要時間は徒歩で3分となります。料金情報としては、秋の特撰会席が6600円となります。他にご用件はございますか？	general,shopping,restaurant,weather
1139	8	USER	それでは予約をお願いします6/2の16:30から4名でお願いします。	general,shopping,restaurant,weather
1139	9	SYSTEM	承知しました。予約が完了し、ご予約番号は、6608となります。他にご案内できることはございますか？	general,shopping,restaurant,weather
1139	10	USER	当日6/2の天白区の天気も教えて下さい	general,shopping,restaurant,weather
1139	11	SYSTEM	はい、天気は雨のち曇、最低気温19.9度、最高気温26.9度となります。他にご用件はございますか？	general,shopping,restaurant,weather
1139	12	USER	有難うございました、大丈夫です。	general,shopping,restaurant,weather
1139	13	SYSTEM	ありがとうございました。	general,shopping,restaurant,weather
