dialogue_id	turn_id	speaker	utterance	goal_domains
1188	0	USER	札幌への旅行を考えているのですが、Wi-Fiと駐車場が無料で利用できる宿泊施設を教えてください。	general,hotel,shopping,taxi
1188	1	SYSTEM	承知しました。エリアでいうと中央区にございます、JRタワーホテル日航札幌はいかがでしょう？何かご案内致しましょうか？	general,hotel,shopping,taxi
1188	2	USER	そこにします。4人で3/12から4泊予約お願いできますか？	general,hotel,shopping,taxi
1188	3	SYSTEM	承知しました。予約が完了し、ご予約番号は、64497となります。他にご案内できることはございますか？	general,hotel,shopping,taxi
1188	4	USER	ありがとうございます。最寄り駅が新さっぽろ駅の、買い物ができる場所も教えてほしいです。	general,hotel,shopping,taxi
1188	5	SYSTEM	はい、では、エリアでいうと厚別区にございます、サンピアザ・デュオはいかがでしょう？何かご案内致しましょうか？	general,hotel,shopping,taxi
1188	6	USER	いいですね。そこの住所を教えてほしいです。	general,hotel,shopping,taxi
1188	7	SYSTEM	はい、住所は、北海道札幌市厚別区厚別中央二条5丁目7となります。他にご案内できることはございますか？	general,hotel,shopping,taxi
1188	8	USER	わかりました。ジャンボタクシーの利用も考えているのですが、キャッシュレス払いができるところはありますか？	general,hotel,shopping,taxi
1188	9	SYSTEM	申し訳ありません、その条件ではご案内ができません。いかが致しましょう？	general,hotel,shopping,taxi
1188	10	USER	そうですか。ならキャッシュレス払いできなくても大丈夫です。	general,hotel,shopping,taxi
1188	11	SYSTEM	ありがとうございます。では、つばめ自動車(株)はいかがでしょう？電話番号は0118112121となります。予約されますか？	general,hotel,shopping,taxi
1188	12	USER	はい、お願いします。3/12の12:40で、JRタワーホテル日航札幌からサンピアザ・デュオまでお願いします。	general,hotel,shopping,taxi
1188	13	SYSTEM	申し訳ありません、この条件ではご予約ができませんでした。いかが致しましょう？	general,hotel,shopping,taxi
1188	14	USER	なら、時間を13:10に変更します。	general,hotel,shopping,taxi
1188	15	SYSTEM	ありがとうございます。予約が完了し、ご予約番号は、66296となります。他にご用件はございますか？	general,hotel,shopping,taxi
1188	16	USER	ありがとうございます。もう大丈夫です。	general,hotel,shopping,taxi
1188	17	SYSTEM	ありがとうございました。	general,hotel,shopping,taxi
