dialogue_id	turn_id	speaker	utterance	goal_domains
1406	0	USER	京都へ旅行に行きたいのですが、当日のタクシー会社を探しています。キャッシュレス払いできるところが良いのですが。	general,taxi
1406	1	SYSTEM	そうしますと、株式会社キャビックはいかがでしょうか？	general,taxi
1406	2	USER	ありがとうございます。株式会社キャビックの電話番号とジャンボタクシー対応があるか教えてもらえますか？	general,taxi
1406	3	SYSTEM	電話番号は、0758642100です。ジャンボタクシーにも対応してございます。	general,taxi
1406	4	USER	ありがとうございます。予約をしたいのですが、8/25の15：00から、ポケモンセンターキョウトからなごみ旅館 悠までお願いできますか？	general,taxi
1406	5	SYSTEM	かしこまりました。ご予約をお入れいたしました。予約番号は、4411です。お手元にお控えくださいませ。	general,taxi
1406	6	USER	ありがとうございました。	general,taxi
1406	7	SYSTEM	ほかにお手伝いできることはございませんか？	general,taxi
1406	8	USER	いえ、今は大丈夫です。ありがとうございました。	general,taxi
1406	9	SYSTEM	ではご利用ありがとうございました。また何かございましたら、お気軽にお問い合わせください。	general,taxi
