dialogue_id	turn_id	speaker	utterance	goal_domains
1450	0	USER	東京へ旅行に行くんですが、買い物ができるところを探してほしいです！	general,shopping,attraction,weather
1450	1	SYSTEM	かしこまりました。ご希望の条件はございますか。	general,shopping,attraction,weather
1450	2	USER	世田谷区でお願いします。	general,shopping,attraction,weather
1450	3	SYSTEM	申し訳ございません。世田谷区ではご案内できるところがございませんでした。いかがなさいますか。	general,shopping,attraction,weather
1450	4	USER	では地区はどこでも大丈夫です！	general,shopping,attraction,weather
1450	5	SYSTEM	ではKITTE丸の内はいかがでしょうか。	general,shopping,attraction,weather
1450	6	USER	そちらのジャンルと、近辺の駅からの所要時間について教えてください。	general,shopping,attraction,weather
1450	7	SYSTEM	ジャンルはショッピングモールでございます。東京駅から徒歩で1分、有楽町駅から徒歩で6分、二重橋前〈丸の内〉駅から徒歩で2分、大手町駅から徒歩で4分でございます。	general,shopping,attraction,weather
1450	8	USER	ありがとうございます。板橋区の観光名所も探して欲しいんですが、いいですかね？	general,shopping,attraction,weather
1450	9	SYSTEM	申し訳ございません。その条件で案内できるところがございませんでした。いかがなさいますか。	general,shopping,attraction,weather
1450	10	USER	では、地区はどこでも大丈夫なので、駐車場が無料のところでお願いします！	general,shopping,attraction,weather
1450	11	SYSTEM	では根津美術館がございます。	general,shopping,attraction,weather
1450	12	USER	ジャンルと大人入場料について教えてください。	general,shopping,attraction,weather
1450	13	SYSTEM	ジャンルは美術館・博物館、大人の入場料は1600円でございます。	general,shopping,attraction,weather
1450	14	USER	ありがとうございます。最後に7/11の豊島区の天候を教えてください。	general,shopping,attraction,weather
1450	15	SYSTEM	天気は雨時々曇、最低気温が25.1度、最高気温が26.4度でございます。	general,shopping,attraction,weather
1450	16	USER	ありがとうございます。大変助かりました！	general,shopping,attraction,weather
1450	17	SYSTEM	承知しました。ありがとうございました。	general,shopping,attraction,weather
