dialogue_id	turn_id	speaker	utterance	goal_domains
1522	0	USER	東京旅行の際に当日食事ができる飲食店を探して頂けますか？	general,restaurant,weather
1522	1	SYSTEM	承知しました。何かご希望はございますか？	general,restaurant,weather
1522	2	USER	．駐車場を無料で利用できるところがいいです。	general,restaurant,weather
1522	3	SYSTEM	ありがとうございます。エリアでいうと港区にある、醍醐 お台場店はいかがでしょう？	general,restaurant,weather
1522	4	USER	そちらにします。最寄り駅とWi-Fiの有無を教えていただけますでしょうか。	general,restaurant,weather
1522	5	SYSTEM	はい、最寄りのお台場海浜公園駅から徒歩で4分となります。申し訳ありませんが、Wi-Fiの有無については不明です。他にご案内できることはございますか？	general,restaurant,weather
1522	6	USER	ありがとうございます。当日の天候が知りたいので中央区の4/9の天気について教えていただけますでしょうか。	general,restaurant,weather
1522	7	SYSTEM	はい、天気は曇時々雨、最低気温3.4度、最高気温16.4度となります。他にご用件はございますか？	general,restaurant,weather
1522	8	USER	大丈夫です。ありがとうございました。	general,restaurant,weather
