dialogue_id	turn_id	speaker	utterance	goal_domains
1590	0	USER	札幌でタクシーを探しているのですが、キャッシュレス対応しているタクシー会社をご存じでしょうか？	general,taxi
1590	1	SYSTEM	はい、12件ほどご案内可能です。例えば、寿ハイヤー(株)というところがございますが、いかがでしょうか？	general,taxi
1590	2	USER	ありがとうございます、そちらの電話番号とジャンボタクシーに対応しているかどうか教えていただけますか？	general,taxi
1590	3	SYSTEM	電話番号は、0115726000です。ジャンボタクシーについては、申し訳ありません、こちらは非対応となります。	general,taxi
1590	4	USER	承知しました、では1/20の12:30にホテルサンルート札幌というところからもりもと ミュンヘン大橋店まで予約をお願いできますか？	general,taxi
1590	5	SYSTEM	かしこまりました。ご予約完了いたしました。予約番号は、94547でございます。	general,taxi
1590	6	USER	ありがとうございます。大変助かりました。あとは大丈夫ですので、これで失礼いたします。	general,taxi
1590	7	SYSTEM	承知いたしました。本日はご利用ありがとうございました。	general,taxi
