dialogue_id	turn_id	speaker	utterance	goal_domains
1850	0	USER	福岡の南区で駐車場が無料の飲食店を見つけてもらえませんか？	general,restaurant,weather
1850	1	SYSTEM	かしこまりました。では、札幌かに本家 福岡那の川店はいかがでしょうか？ジャンルは和食, 寿司・魚料理になります。	general,restaurant,weather
1850	2	USER	素敵な感じですね。近い駅からどのぐらいかかりますか？あと値段帯的にはどのぐらいですか？	general,restaurant,weather
1850	3	SYSTEM	最寄り駅の西鉄平尾駅から徒歩で10分です。値段帯的には高めになります。	general,restaurant,weather
1850	4	USER	わかりました。5月29日12時50分に、3人で予約を取れますか？	general,restaurant,weather
1850	5	SYSTEM	かしこまりました。ご予約承りました。予約番号は、3897です。	general,restaurant,weather
1850	6	USER	同じ日の中央区の天候は調べられますか？	general,restaurant,weather
1850	7	SYSTEM	かしこまりました。5/29の中央区の天気予報は曇時々雨となっております。最低気温は16.4度、最高気温は25.5度になる予報です。	general,restaurant,weather
1850	8	USER	詳しく調べていただいてありがとうございました。予約もしてもらえて助かりました。お世話になりました。	general,restaurant,weather
