dialogue_id	turn_id	speaker	utterance	goal_domains
2098	0	USER	大阪への旅行を検討しています。当日行く観光名所を探しているのですが、お伺いしてもよろしいでしょうか？	general,attraction,restaurant,hotel
2098	1	SYSTEM	かしこまりました。何か他の希望の要件はございますか？	general,attraction,restaurant,hotel
2098	2	USER	はい。浪速区で絶景が見れる場所ってありますか？	general,attraction,restaurant,hotel
2098	3	SYSTEM	かしこまりました。では、通天閣はいかがでしょうか？	general,attraction,restaurant,hotel
2098	4	USER	ちなみに、その施設ではWi-Fiが無料で利用できますか？	general,attraction,restaurant,hotel
2098	5	SYSTEM	はい。利用できます。	general,attraction,restaurant,hotel
2098	6	USER	助かります。この施設の住所を教えて貰えますか？	general,attraction,restaurant,hotel
2098	7	SYSTEM	はい。住所は大阪府大阪市浪速区恵美須東1丁目18-6です。	general,attraction,restaurant,hotel
2098	8	USER	ありがとうございます。それと、当時の飲食店も探しているのですが、続けてよろしいでしょうか？	general,attraction,restaurant,hotel
2098	9	SYSTEM	はい。ご案内させていただきます。	general,attraction,restaurant,hotel
2098	10	USER	北区で、最寄り駅が西梅田駅でお願いします。駐車場を無料で利用できればありがたいです。	general,attraction,restaurant,hotel
2098	11	SYSTEM	申し訳ございません。条件に合う飲食店の施設は見つかりませんでした。	general,attraction,restaurant,hotel
2098	12	USER	そうですか。でしたら、駐車場は大丈夫ですので、何処か該当するお店はありそうでしょうか？	general,attraction,restaurant,hotel
2098	13	SYSTEM	かしこまりました。では、BLT STEAK OSAKAはいかがでしょうか？	general,attraction,restaurant,hotel
2098	14	USER	そちらで検討してみようと思います。ちなみに、このお店の値段帯とかってわかりますかね？	general,attraction,restaurant,hotel
2098	15	SYSTEM	はい。値段帯は高めです。	general,attraction,restaurant,hotel
2098	16	USER	ありがとうございます。それと、営業時間と、定休日も知りたいです。	general,attraction,restaurant,hotel
2098	17	SYSTEM	はい。営業時間は11:30～15:00, 17:00～22:00です。定休日は無しとなっております。	general,attraction,restaurant,hotel
2098	18	USER	ありがとうございます。最後に、当日宿泊できる施設を探しているのですが、よろしいでしょうか？	general,attraction,restaurant,hotel
2098	19	SYSTEM	はい。ご案内させていただきます。	general,attraction,restaurant,hotel
2098	20	USER	Wi-Fiが無料で利用できる施設だとありがたいです。何処か該当する場所はありそうですか？	general,attraction,restaurant,hotel
2098	21	SYSTEM	かしこまりました。では、ダイワロイネットホテル四ツ橋はいかがでしょうか？	general,attraction,restaurant,hotel
2098	22	USER	良さそうですね。ちなみに、このホテルのチェックアウト終了時刻ってわかりますか？	general,attraction,restaurant,hotel
2098	23	SYSTEM	はい。チェックアウト終了時刻は11:00です。	general,attraction,restaurant,hotel
2098	24	USER	ありがとうございます。それと、駐車場ってありますかね？	general,attraction,restaurant,hotel
2098	25	SYSTEM	はい。有料のものがございます。	general,attraction,restaurant,hotel
2098	26	USER	ありがとうございます。出来れば、このまま予約をお願いしたいのですが、よろしいでしょうか？	general,attraction,restaurant,hotel
2098	27	SYSTEM	はい。詳細な情報を教えてくださいますか？	general,attraction,restaurant,hotel
2098	28	USER	はい。日時は6月9日で、人数は3人。4泊を予定しています。	general,attraction,restaurant,hotel
2098	29	SYSTEM	かしこまりました。ご予約承りました。予約番号は、32375です。	general,attraction,restaurant,hotel
2098	30	USER	ありがとうございます。これで当日は大丈夫そうです。ご対応、ありがとうございました。	general,attraction,restaurant,hotel
2098	31	SYSTEM	承知しました。ありがとうございました。	general,attraction,restaurant,hotel
