dialogue_id	turn_id	speaker	utterance	goal_domains
2167	0	USER	こんにちは。今東京への旅行を計画しているんですが、タクシー会社を探しています。キャッシュレス払いができるタクシー会社をお願いします。	general,taxi
2167	1	SYSTEM	かしこまりました。それではキャピタルオートはいかがでしょうか？	general,taxi
2167	2	USER	電話番号をお願いします。	general,taxi
2167	3	SYSTEM	電話番号は0357552151でございます。	general,taxi
2167	4	USER	そちらのタクシー会社で予約をお願いします。9/16の11:40で銀座 鮨 奈可久から小石川後楽園へ行きたいです。	general,taxi
2167	5	SYSTEM	お待たせ致しました。予約番号92912でお取りさせていただきました。	general,taxi
2167	6	USER	どうもありがとうございました。お願いは以上です。	general,taxi
2167	7	SYSTEM	かしこまりました。ありがとうございました。	general,taxi
