dialogue_id	turn_id	speaker	utterance	goal_domains
2822	0	USER	福岡に行くのですが、コンビニを探しています。	general,shopping,weather
2822	1	SYSTEM	そうしますと、4件ご案内可能です。エリアなど、ご希望はございませんか？	general,shopping,weather
2822	2	USER	中央区で次郎丸駅の近くが良いです。	general,shopping,weather
2822	3	SYSTEM	申し訳ございません。その条件ですと、ご案内できるところがありませんでした。	general,shopping,weather
2822	4	USER	じゃ次郎丸駅の近くでなくてもいいです。	general,shopping,weather
2822	5	SYSTEM	かしこまりました。では、ファミリーマート福岡天神店はいかがでしょうか？最寄りは、天神駅となります。	general,shopping,weather
2822	6	USER	いいですね。あと3/6、東区の天気が知りたいです。	general,shopping,weather
2822	7	SYSTEM	かしこまりました。当日の天気は、曇のち雨の予報です。	general,shopping,weather
2822	8	USER	ありがとうございます。	general,shopping,weather
2822	9	SYSTEM	他にお調べすることはございませんか？	general,shopping,weather
2822	10	USER	特にないです。	general,shopping,weather
2822	11	SYSTEM	承知いたしました。本日はご利用ありがとうございました。	general,shopping,weather
