dialogue_id	turn_id	speaker	utterance	goal_domains
3058	0	USER	大阪への旅行を検討しています。当日訪れる観光名所を探しているのですが、色々お伺いしてもよろしいでしょうか？	general,attraction,hotel,shopping
3058	1	SYSTEM	はい、ご希望をどうぞ	general,attraction,hotel,shopping
3058	2	USER	ありがとうございます。駐車場を無料で利用できて、Wi-Fiも無料で利用出来れば最高なのですが、どうでしょうか？	general,attraction,hotel,shopping
3058	3	SYSTEM	大阪では駐車場もWiFiも無料で利用できる観光名所はなさそうです。	general,attraction,hotel,shopping
3058	4	USER	そうですか、では、Wi-Fiは大丈夫ですので、駐車場を無料で利用できる施設はありますか？	general,attraction,hotel,shopping
3058	5	SYSTEM	大阪で駐車場無料の観光地といえば、大阪天満宮、こちらがオススメです。	general,attraction,hotel,shopping
3058	6	USER	良さそうですね。この施設の電話番号ってわかりますか？	general,attraction,hotel,shopping
3058	7	SYSTEM	0663530025です。	general,attraction,hotel,shopping
3058	8	USER	ありがとうございます。ちなみに、そこは何処のエリアにありますか？	general,attraction,hotel,shopping
3058	9	SYSTEM	北区になります。	general,attraction,hotel,shopping
3058	10	USER	ありがとうございます。それと、子供がいるので、子供の入場料もお伺いしたいです。	general,attraction,hotel,shopping
3058	11	SYSTEM	大人も子供も、入場無料です。	general,attraction,hotel,shopping
3058	12	USER	助かります。それと、当日利用する宿泊施設も探しているのですが、探して頂いてもよろしいでしょうか？	general,attraction,hotel,shopping
3058	13	SYSTEM	ご希望をどうぞ	general,attraction,hotel,shopping
3058	14	USER	はい。中央区で探しています。	general,attraction,hotel,shopping
3058	15	SYSTEM	大阪中央区の宿泊施設といえば、39件ほどヒットします。追加の希望条件はありますか。	general,attraction,hotel,shopping
3058	16	USER	いえ、地区以外にこだわりはありません。	general,attraction,hotel,shopping
3058	17	SYSTEM	それでは、なんばオリエンタルホテル、こちらをおすすめします。	general,attraction,hotel,shopping
3058	18	USER	なるほど。このホテルのチェックイン・アウトの時間を教えて貰えますか？	general,attraction,hotel,shopping
3058	19	SYSTEM	チェックインは夕方３時から、チェックアウトは朝１１時までです。	general,attraction,hotel,shopping
3058	20	USER	ありがとうございます。このまま予約をお願いしたいのですが、よろしいでしょうか？	general,attraction,hotel,shopping
3058	21	SYSTEM	はい、人数と日付、何泊予定でしょうか	general,attraction,hotel,shopping
3058	22	USER	はい。人数は3人で、8月17日。3泊でお願いしたいです。	general,attraction,hotel,shopping
3058	23	SYSTEM	この条件で予約成功しました。予約番号は91947です。	general,attraction,hotel,shopping
3058	24	USER	ありがとうございます。最後に、当日買い物が出来る場所を探しているのですが、お伺いしてもよろしいでしょうか？	general,attraction,hotel,shopping
3058	25	SYSTEM	はい、ご希望をどうぞ	general,attraction,hotel,shopping
3058	26	USER	はい。最寄り駅が門真南駅で、駐車場を無料で利用できる施設ってありますかね？	general,attraction,hotel,shopping
3058	27	SYSTEM	門真南駅、駐車場無料の買い物施設といえば、三井アウトレットパーク 大阪鶴見、こちらになります。	general,attraction,hotel,shopping
3058	28	USER	そこに決めたいと思います。この施設の電話番号を教えて頂けますか？	general,attraction,hotel,shopping
3058	29	SYSTEM	0669153939になります。	general,attraction,hotel,shopping
3058	30	USER	ありがとうございます。これで当日は大丈夫そうです。ご対応、ありがとうございました。	general,attraction,hotel,shopping
3058	31	SYSTEM	よい旅を	general,attraction,hotel,shopping
