dialogue_id	turn_id	speaker	utterance	goal_domains
3230	0	USER	大阪に旅行をするんですが、駐車場もWi-Fiも無料の観光名所ってありますか？	general,attraction,taxi,weather
3230	1	SYSTEM	申し訳ございません。条件に合う観光名所は見つかりませんでした。	general,attraction,taxi,weather
3230	2	USER	そうですか。駐車場は有料でも構いませんが、それなら見つかりそうでしょうか？	general,attraction,taxi,weather
3230	3	SYSTEM	かしこまりました。では、海遊館はいかがでしょうか？	general,attraction,taxi,weather
3230	4	USER	良いですね。当日は株式会社国際興業大阪のタクシーを利用したいのですが、案内していただけますか？	general,attraction,taxi,weather
3230	5	SYSTEM	はい。何かお調べしましょうか？	general,attraction,taxi,weather
3230	6	USER	はい、株式会社国際興業大阪はジャンボタクシーやキャッシュレスにも対応しているタクシー会社なのでしょうか？電話番号もお願いします。	general,attraction,taxi,weather
3230	7	SYSTEM	はい。ジャンボタクシーとキャッシュレスに対応しております。電話番号は0570035931です。	general,attraction,taxi,weather
3230	8	USER	分かりました。それでは7/21に予約を取ってください。10:50にホテルランドマーク梅田を出発して、行先は海遊館です。	general,attraction,taxi,weather
3230	9	SYSTEM	午前10:50でよろしかったですか？	general,attraction,taxi,weather
3230	10	USER	はい。	general,attraction,taxi,weather
3230	11	SYSTEM	申し訳ございません。その条件では予約できませんでした。どうされますか。	general,attraction,taxi,weather
3230	12	USER	そうですね、それでは時間を11:50に変更してなら予約が取れますか？	general,attraction,taxi,weather
3230	13	SYSTEM	かしこまりました。ご予約承りました。予約番号は、87334です。	general,attraction,taxi,weather
3230	14	USER	ありがとうございます。この7/21なのですが、住之江区の天気はどうでしょうか？最低気温がどのくらいかも知りたいです。	general,attraction,taxi,weather
3230	15	SYSTEM	かしこまりました。7/21の住之江区の天気予報は曇のち雨となっております。最低気温は22.4度、最高気温は31.9度になる予報です。	general,attraction,taxi,weather
3230	16	USER	ありがとうございます、これで以上です。	general,attraction,taxi,weather
3230	17	SYSTEM	承知しました。ありがとうございました。	general,attraction,taxi,weather
