dialogue_id	turn_id	speaker	utterance	goal_domains
3487	0	USER	京都旅行に行くので宿泊施設を探してほしいです。	general,hotel,restaurant
3487	1	SYSTEM	かしこまりました。ご希望の条件はございますか。	general,hotel,restaurant
3487	2	USER	南区でレストランがあるところがいいです	general,hotel,restaurant
3487	3	SYSTEM	ではリーガグラン京都はいかがでしょうか。	general,hotel,restaurant
3487	4	USER	そこにします。近辺の駅からどれくらいかかりますか？	general,hotel,restaurant
3487	5	SYSTEM	京都駅から徒歩で3分、九条駅から徒歩で3分でございます。	general,hotel,restaurant
3487	6	USER	そうなんですね、駐車場はありますか？	general,hotel,restaurant
3487	7	SYSTEM	有料ですが、駐車場はございます。	general,hotel,restaurant
3487	8	USER	分かりました。予約をお願いしたいです	general,hotel,restaurant
3487	9	SYSTEM	かしこまりました。ご予約の詳細をお聞かせいただけますか。	general,hotel,restaurant
3487	10	USER	3名で、2/27、二泊でお願いします。	general,hotel,restaurant
3487	11	SYSTEM	申し訳ございません。その条件では予約ができませんでした。いかがなさいますか。	general,hotel,restaurant
3487	12	USER	人数を2名にしたらどうでしょうか？	general,hotel,restaurant
3487	13	SYSTEM	2名ですと予約が可能でございました。予約番号は21757でございます。	general,hotel,restaurant
3487	14	USER	ありがとうございます。あと飲食店を探してほしいのですが。	general,hotel,restaurant
3487	15	SYSTEM	かしこまりました。ご希望の条件はございますか。	general,hotel,restaurant
3487	16	USER	中京区で最寄り駅は二条城前駅、予算が高めのところがいいです。	general,hotel,restaurant
3487	17	SYSTEM	ではしし翁がございます。	general,hotel,restaurant
3487	18	USER	Wi-Fiはありますか？	general,hotel,restaurant
3487	19	SYSTEM	Wi-Fiの有無は不明でございます。	general,hotel,restaurant
3487	20	USER	そうですか。近辺の駅からの所要時間はどれくらいですか？	general,hotel,restaurant
3487	21	SYSTEM	二条城前駅から徒歩で5分、烏丸御池駅から徒歩で10分でございます。	general,hotel,restaurant
3487	22	USER	わかりました、予約をお願いします	general,hotel,restaurant
3487	23	SYSTEM	かしこまりました。ご予約の詳細をお聞かせいただけますか。	general,hotel,restaurant
3487	24	USER	3人で、2/27、時間が12:10です	general,hotel,restaurant
3487	25	SYSTEM	申し訳ございません。その条件では予約ができませんでした。いかがなさいますか。	general,hotel,restaurant
3487	26	USER	人数を3人から2人にしたらどうでしょうか？	general,hotel,restaurant
3487	27	SYSTEM	2名ですと予約が可能でございました。予約番号は89094でございます。	general,hotel,restaurant
3487	28	USER	ありがとうございました！	general,hotel,restaurant
3487	29	SYSTEM	ほかにご用件はございませんか。	general,hotel,restaurant
3487	30	USER	大丈夫です。ありがとうございました！	general,hotel,restaurant
3487	31	SYSTEM	承知しました。ありがとうございました。	general,hotel,restaurant
