dialogue_id	turn_id	speaker	utterance	goal_domains
3556	0	USER	名古屋で泊まる宿泊施設を探してください。	general,hotel,shopping,taxi
3556	1	SYSTEM	承知しました。ご希望の条件はございますか。	general,hotel,shopping,taxi
3556	2	USER	駐車場無料、Wi-Fi無料、レストラン併設が希望です。	general,hotel,shopping,taxi
3556	3	SYSTEM	かしこまりました。ではプチホテル ニューひふみはいかがでしょうか。	general,hotel,shopping,taxi
3556	4	USER	エリア，最寄り駅を教えてください。	general,hotel,shopping,taxi
3556	5	SYSTEM	エリアは中川区、最寄り駅が尾頭橋駅でございます。	general,hotel,shopping,taxi
3556	6	USER	買い物ができるところを探してほしいです。ジャンルはおもちゃ、駐車場を無料で利用できるところにしてください。	general,hotel,shopping,taxi
3556	7	SYSTEM	ではポケモンセンターナゴヤはいかがでしょうか。	general,hotel,shopping,taxi
3556	8	USER	いいですね。当日利用できるタクシー会社で、ジャンボタクシーを利用できるところを探してほしいです。	general,hotel,shopping,taxi
3556	9	SYSTEM	名古屋エムケイがございます。	general,hotel,shopping,taxi
3556	10	USER	電話番号を教えてください。	general,hotel,shopping,taxi
3556	11	SYSTEM	電話番号は0529125908でございます。	general,hotel,shopping,taxi
3556	12	USER	予約してください。日付は5/27、時間は13:10、出発地はプチホテル ニューひふみ、目的地はポケモンセンターナゴヤです。	general,hotel,shopping,taxi
3556	13	SYSTEM	申し訳ございません。その条件では予約ができませんでした。いかがなさいますか。	general,hotel,shopping,taxi
3556	14	USER	時間を14:10に変更したらどうでしょうか。	general,hotel,shopping,taxi
3556	15	SYSTEM	その時間ですと予約が可能でございました。予約番号は99849でございます。	general,hotel,shopping,taxi
3556	16	USER	解決しました。ありがとうございました。	general,hotel,shopping,taxi
3556	17	SYSTEM	本日はありがとうございました。	general,hotel,shopping,taxi
