dialogue_id	turn_id	speaker	utterance	goal_domains
3607	0	USER	札幌でWi-Fiと駐車場が無料のリゾートホテルはありますか？	general,hotel,attraction,weather
3607	1	SYSTEM	かしこまりました。定山渓万世閣ホテルミリオーネがございます。	general,hotel,attraction,weather
3607	2	USER	最寄り駅はどこになりますか？	general,hotel,attraction,weather
3607	3	SYSTEM	最寄り駅は札幌駅でございます。	general,hotel,attraction,weather
3607	4	USER	わかりました。あとWi-Fiが無料でジャンルがエンタメ・アミューズメントの観光名所も探しています。	general,hotel,attraction,weather
3607	5	SYSTEM	ではラウンドワンスタジアム札幌北21条店はいかがですか。	general,hotel,attraction,weather
3607	6	USER	住所はどこになりますか？	general,hotel,attraction,weather
3607	7	SYSTEM	住所は北海道札幌市東区北21条東1丁目1-21でございます。	general,hotel,attraction,weather
3607	8	USER	わかりました。最後に8/12の西区の気温を教えてください。	general,hotel,attraction,weather
3607	9	SYSTEM	当日の最低気温は17.7度で、最高気温は23.1度でございます。	general,hotel,attraction,weather
3607	10	USER	わかりました。ありがとうございました。	general,hotel,attraction,weather
3607	11	SYSTEM	本日はありがとうございました。	general,hotel,attraction,weather
