dialogue_id	turn_id	speaker	utterance	goal_domains
3702	0	USER	こんにちは。福岡に行くのですが、早良区でうどん・そばの飲食店はありますか？	general,restaurant,shopping,hotel
3702	1	SYSTEM	申し訳ありません。その条件ではお探しすることが出来ませんでした。	general,restaurant,shopping,hotel
3702	2	USER	では地区はこだわりません。	general,restaurant,shopping,hotel
3702	3	SYSTEM	かしこまりました。それでは博多やりうどん福岡店がございます。	general,restaurant,shopping,hotel
3702	4	USER	ありがとうございます。そこの最寄り駅はわかりますか？	general,restaurant,shopping,hotel
3702	5	SYSTEM	はい、西鉄福岡(天神)駅でございます。	general,restaurant,shopping,hotel
3702	6	USER	ありがとうございます。ではそのお店で、人数は2人、日付は6/5、時間は14:00で、予約をお願いします。	general,restaurant,shopping,hotel
3702	7	SYSTEM	申し訳ありません。その条件では予約を取ることが出来ませんでした。	general,restaurant,shopping,hotel
3702	8	USER	では人数を1人に変更したら予約できそうですか？	general,restaurant,shopping,hotel
3702	9	SYSTEM	お待たせ致しました。予約番号87565でお取りさせていただきました。	general,restaurant,shopping,hotel
3702	10	USER	ありがとうございます。駐車場が無料で使えて、最寄り駅が福岡駅な、買い物スポットはないですか？	general,restaurant,shopping,hotel
3702	11	SYSTEM	申し訳ありません。その条件ではお探しすることが出来ませんでした。	general,restaurant,shopping,hotel
3702	12	USER	では最寄り駅はこだわりません。	general,restaurant,shopping,hotel
3702	13	SYSTEM	お待たせ致しました。それではヨドバシ博多はいかがでしょうか？	general,restaurant,shopping,hotel
3702	14	USER	ありがとうございます。そこにしようかな。そのお店の、住所と近辺の駅からの所要時間もわかりますか？	general,restaurant,shopping,hotel
3702	15	SYSTEM	はい、住所は福岡県福岡市博多区博多駅中央街6-12でして、近辺の駅からですと博多駅から徒歩で1分でございます。	general,restaurant,shopping,hotel
3702	16	USER	ありがとうございます。あと、駐車場とWi-Fiが無料で使える、予算が普通な、宿泊施設も探してもらえますか？	general,restaurant,shopping,hotel
3702	17	SYSTEM	お待たせ致しました。それではWITH THE STYLE FUKUOKAがございます。	general,restaurant,shopping,hotel
3702	18	USER	ありがとうございます。そこってレストランはありますか？	general,restaurant,shopping,hotel
3702	19	SYSTEM	はい、レストランも併設されております。	general,restaurant,shopping,hotel
3702	20	USER	ありがとうございます。ではその宿泊施設で、人数は3人、日付は6/5、宿泊日数は2泊で、予約をお願いします。	general,restaurant,shopping,hotel
3702	21	SYSTEM	お待たせ致しました。予約番号52563でお取りさせていただきました。	general,restaurant,shopping,hotel
3702	22	USER	ありがとうございます。	general,restaurant,shopping,hotel
3702	23	SYSTEM	その他にご用件はございますか？	general,restaurant,shopping,hotel
3702	24	USER	いえ、大丈夫です。案内ありがとうございました。	general,restaurant,shopping,hotel
3702	25	SYSTEM	ありがとうございました。またお待ちしております。	general,restaurant,shopping,hotel
