dialogue_id	turn_id	speaker	utterance	goal_domains
376	0	USER	仙台での宿泊施設を探しています。	general,hotel,taxi
376	1	SYSTEM	承知しました。何かご希望はございますか？	general,hotel,taxi
376	2	USER	ホテルクラウンヒルズ仙台青葉通り、という名前のところはありますか？	general,hotel,taxi
376	3	SYSTEM	はい、エリアでいうと青葉区にございます。何かご案内致しましょうか？	general,hotel,taxi
376	4	USER	電話番号と住所を教えていただけますか？	general,hotel,taxi
376	5	SYSTEM	承知しました。住所は宮城県仙台市青葉区中央2丁目3-18、電話番号は、0222621355となります。他にご案内できることはございますか？	general,hotel,taxi
376	6	USER	では、7/7に２名で４泊、予約をお願いします。	general,hotel,taxi
376	7	SYSTEM	承知しました。予約が完了し、ご予約番号は、92708となります。他にご用件はございますか？	general,hotel,taxi
376	8	USER	ありがとうございます。当日タクシーを利用したいのですが、キャッシュレス払いができるところはありますか？	general,hotel,taxi
376	9	SYSTEM	はい、では、（株）フタバタクシーはいかがでしょう？ジャンボタクシーにも対応しております。電話番号は0222369371となります。	general,hotel,taxi
376	10	USER	ありがとうございます。では、7/7の10:30でホテルクラウンヒルズ仙台青葉通り、から、とんかつ新宿さぼてん 仙台セルバテラス店、まで予約をお願いします。	general,hotel,taxi
376	11	SYSTEM	承知しました。予約が完了し、ご予約番号は、69979となります。他にご案内できることはございますか？	general,hotel,taxi
376	12	USER	ありがとうございます。以上です、お世話になりました。	general,hotel,taxi
376	13	SYSTEM	ありがとうございました。	general,hotel,taxi
