dialogue_id	turn_id	speaker	utterance	goal_domains
3763	0	USER	仙台への旅行を考えていて、若林地区で駐車場無料のコンビニを探しています。	general,shopping,attraction
3763	1	SYSTEM	では、セブンイレブン仙台六丁の目駅前店はいかがですか？	general,shopping,attraction
3763	2	USER	営業時間はわかりますか？	general,shopping,attraction
3763	3	SYSTEM	はい、営業時間は、0時から0時までと記載されています。	general,shopping,attraction
3763	4	USER	ありがとうございます。他に、Wi-Fi無料で、泉地区で最寄り駅が陸前高砂駅の観光名所を探しています	general,shopping,attraction
3763	5	SYSTEM	申し訳ありません。　その条件では、見つかりませんでした。	general,shopping,attraction
3763	6	USER	では、最寄り駅は考慮しなくて大丈夫です。	general,shopping,attraction
3763	7	SYSTEM	2件みつかりました。ユアテックスタジアム仙台、こちらはいかがですか？	general,shopping,attraction
3763	8	USER	そちらにします。子供入場料，料金情報を教えて下さい。	general,shopping,attraction
3763	9	SYSTEM	申し訳ありません、子供の入場料は、不明となっています。　料金情報は、無料となっています。	general,shopping,attraction
3763	10	USER	わかりました。他にはありません。	general,shopping,attraction
3763	11	SYSTEM	承知しました。ありがとうございました。	general,shopping,attraction
