dialogue_id	turn_id	speaker	utterance	goal_domains
3803	0	USER	札幌へ行く予定で観光名所を探しています。手稲区でWi-Fiが無料で使えるところってありますか？	general,attraction,taxi
3803	1	SYSTEM	申し訳ありません。その条件ではお探しすることが出来ませんでした。	general,attraction,taxi
3803	2	USER	じゃあ、中央区でありませんか？	general,attraction,taxi
3803	3	SYSTEM	中央区でしたら札幌競馬場はいかがでしょうか？	general,attraction,taxi
3803	4	USER	いいですね、料金情報と住所を教えてください。	general,attraction,taxi
3803	5	SYSTEM	料金情報は分かりません。住所は北海道札幌市中央区北16条西16丁目1-1でございます。	general,attraction,taxi
3803	6	USER	そうですか。あと当日ジャンボタクシーが利用できるタクシー会社はありませんか？	general,attraction,taxi
3803	7	SYSTEM	申し訳ありません。その条件ではお探しすることが出来ませんでした。	general,attraction,taxi
3803	8	USER	では、ジャンボタクシーでなくてもいいです。	general,attraction,taxi
3803	9	SYSTEM	かしこまりました。それでは寿ハイヤー(株)はいかがでしょうか？	general,attraction,taxi
3803	10	USER	ありがとうございます。そこはキャッシュレス対応していますか？	general,attraction,taxi
3803	11	SYSTEM	はい、キャッシュレスにも対応しております。	general,attraction,taxi
3803	12	USER	札幌競馬場から新さっぽろアークシティホテルまでで、10月9日に予約を入れてください。	general,attraction,taxi
3803	13	SYSTEM	かしこまりました。出発時刻はいかがされますか？	general,attraction,taxi
3803	14	USER	10:30にお願いします。	general,attraction,taxi
3803	15	SYSTEM	お待たせ致しました。予約番号81518でお取りさせていただきました。	general,attraction,taxi
3803	16	USER	ありがとうございます。	general,attraction,taxi
3803	17	SYSTEM	ありがとうございました。またお待ちしております。	general,attraction,taxi
