dialogue_id	turn_id	speaker	utterance	goal_domains
3874	0	USER	東京へ行くんですが、北区にある宿泊施設を探してもらえますか？	general,hotel,attraction
3874	1	SYSTEM	申し訳ございません。その条件ですと、お探しすることが出来ませんでした。	general,hotel,attraction
3874	2	USER	そうですか。では、地区にはこだわらずに探してください。	general,hotel,attraction
3874	3	SYSTEM	かしこまりました。それではグランドハイアット東京はいかがでしょうか？	general,hotel,attraction
3874	4	USER	ありがとうございます。そこのチェックアウト終了時刻とレストランの有無も教えてもらえますか？	general,hotel,attraction
3874	5	SYSTEM	チェックアウト終了時刻は12時でございます。レストランは併設されております。	general,hotel,attraction
3874	6	USER	ありがとうございます。ではそこの予約をお願いできますか？9/19から４泊で３名です。	general,hotel,attraction
3874	7	SYSTEM	申し訳ございません。その条件では予約が出来ませんでした。	general,hotel,attraction
3874	8	USER	そうですか。じゃあ２名に変更します。	general,hotel,attraction
3874	9	SYSTEM	お待たせ致しました。予約番号27302でお取りさせていただきました。	general,hotel,attraction
3874	10	USER	ありがとうございます。あと、無料駐車場があって、Wi-Fiも無料の観光名所はありますか？	general,hotel,attraction
3874	11	SYSTEM	申し訳ございません。その条件ではお探しすることが出来ませんでした。	general,hotel,attraction
3874	12	USER	そうですか。じゃあ有料の駐車場でも大丈夫です。	general,hotel,attraction
3874	13	SYSTEM	かしこまりました。それでは、日本科学未来館はいかがでしょうか？	general,hotel,attraction
3874	14	USER	ありがとうございます。そこの営業時間も教えてください。	general,hotel,attraction
3874	15	SYSTEM	はい、営業時間は10時から17時でございます。	general,hotel,attraction
3874	16	USER	ありがとうございました。以上で結構です。	general,hotel,attraction
3874	17	SYSTEM	ありがとうございました。またお待ちしております。	general,hotel,attraction
