dialogue_id	turn_id	speaker	utterance	goal_domains
3912	0	USER	仙台への旅行を計画中で、買い物ができる場所を探しています。	general,shopping,restaurant
3912	1	SYSTEM	承知しました。何かご希望はございますか？	general,shopping,restaurant
3912	2	USER	青葉区内で最寄り駅は大西公園駅、無料駐車場付きがいいです。	general,shopping,restaurant
3912	3	SYSTEM	申し訳ありません、この条件ではご案内ができません。いかが致しましょう？	general,shopping,restaurant
3912	4	USER	分かりました。では、最寄り駅はどこでも構いません。	general,shopping,restaurant
3912	5	SYSTEM	ありがとうございます。では、ホビーステーション 仙台駅前店はいかがでしょう？ジャンルは、おもちゃとなります。	general,shopping,restaurant
3912	6	USER	そこにしようと思います。定休日と電話番号、最寄駅からの所要時間は分かりますか？	general,shopping,restaurant
3912	7	SYSTEM	はい、電話番号は、0222634670、最寄りの仙台駅から徒歩で2分となります。定休日はございません。	general,shopping,restaurant
3912	8	USER	ありがとうございます。当日無料駐車場付きの和食店を探しています。予算は普通がいいです。	general,shopping,restaurant
3912	9	SYSTEM	申し訳ありません、この条件ではご案内ができません。いかが致しましょう？	general,shopping,restaurant
3912	10	USER	分かりました。では、予算はいくらでも構いません	general,shopping,restaurant
3912	11	SYSTEM	ありがとうございます。では、エリアでいうと宮城野区にある、四季亭 竹勢はいかがでしょう？	general,shopping,restaurant
3912	12	USER	そこにしようと思います。住所を教えてください。	general,shopping,restaurant
3912	13	SYSTEM	はい、住所は、宮城県仙台市宮城野区田子1丁目11-11となります。	general,shopping,restaurant
3912	14	USER	助かりました。ありがとうございました。	general,shopping,restaurant
3912	15	SYSTEM	ありがとうございました。	general,shopping,restaurant
