dialogue_id	turn_id	speaker	utterance	goal_domains
410	0	USER	大阪で宿泊施設を探しています。	general,hotel,shopping,taxi
410	1	SYSTEM	かしこまりました。宿泊施設のタイプなどで、ご希望はございませんか？	general,hotel,shopping,taxi
410	2	USER	レストランが併設されていて、駐車場が無料で使えるところがいいです。	general,hotel,shopping,taxi
410	3	SYSTEM	そういたしますと、2件候補がございます。アスティルホテル十三プレシャスというビジネスホテルと、ビジネス旅館 励明園という旅館がありますが、気になる方はございますか？	general,hotel,shopping,taxi
410	4	USER	なるほど。予算が安めの方がいいのですが、どうでしょうか。	general,hotel,shopping,taxi
410	5	SYSTEM	では、アスティルホテル十三プレシャスは如何でしょうか？	general,hotel,shopping,taxi
410	6	USER	そこにします。ホテルのあるエリアとチェックアウト終了時刻を教えてもらえますか	general,hotel,shopping,taxi
410	7	SYSTEM	エリアは淀川区となっております。チェックアウト終了時刻は11時です。	general,hotel,shopping,taxi
410	8	USER	わかりました。ありがとうございました。	general,hotel,shopping,taxi
410	9	SYSTEM	ほかにお手伝いできることはありますか？	general,hotel,shopping,taxi
410	10	USER	大丈夫です。	general,hotel,shopping,taxi
410	11	SYSTEM	承知しました。またのご利用をお待ちしております。	general,hotel,shopping,taxi
410	12	USER	あ、すみません、買い物ができる場所も探して欲しいです。	general,hotel,shopping,taxi
410	13	SYSTEM	かしこまりました。お店のあるエリア等で、ご希望はございますか？	general,hotel,shopping,taxi
410	14	USER	北区で駐車場が無料で使えるショッピングモールがあれば知りたいです。	general,hotel,shopping,taxi
410	15	SYSTEM	大変申し訳ございません。その条件ですと、該当する場所がありませんでした。	general,hotel,shopping,taxi
410	16	USER	そうですか。駐車場が有料だったらありますか？	general,hotel,shopping,taxi
410	17	SYSTEM	はい、2件ございます。NU茶屋町というところと、ディアモール大阪というお店です。	general,hotel,shopping,taxi
410	18	USER	わりました。ありがとうございます。	general,hotel,shopping,taxi
410	19	SYSTEM	なにかほかにお手伝いできることはありますか？	general,hotel,shopping,taxi
410	20	USER	当日タクシーを使いたいのですが、キャッシュレス決済ができるタクシー会社はありますか？	general,hotel,shopping,taxi
410	21	SYSTEM	はい、13件ほど候補がございます。相互タクシー株式会社でしたら、キャッシュレスのお支払いの他、ジャンボタクシーにも対応しておりますよ。	general,hotel,shopping,taxi
410	22	USER	わかりました。では、そちらの電話番号を教えてもらえますか？	general,hotel,shopping,taxi
410	23	SYSTEM	はい。電話番号は、0669315489でございます。	general,hotel,shopping,taxi
410	24	USER	ありがとうございます。予約をお願いしたいのですが。	general,hotel,shopping,taxi
410	25	SYSTEM	かしこまりました。ご利用予定の日付と出発時刻、出発地と目的地はお決まりでしょうか？	general,hotel,shopping,taxi
410	26	USER	日付は6/15で出発時刻は11:50です。アスティルホテル十三プレシャスからディアモール大阪まででお願いします。	general,hotel,shopping,taxi
410	27	SYSTEM	かしこまりました。予約が完了いたしました。ご予約番号は、22087です、	general,hotel,shopping,taxi
410	28	USER	ありがとうございます。助かりました。	general,hotel,shopping,taxi
