dialogue_id	turn_id	speaker	utterance	goal_domains
4364	0	USER	福岡への旅行を計画しています。当日利用できるタクシーを探していてできればジャンボタクシーがよいと考えておりますがご案内いただけますか。	general,taxi
4364	1	SYSTEM	かしこまりました。では、西日本自動車（株）はいかがでしょうか？	general,taxi
4364	2	USER	ありがとうございます。そちらはキャッシュレス払いは可能でしょうか。	general,taxi
4364	3	SYSTEM	申し訳ありません、キャッシュレス払いについては、不明となっております。	general,taxi
4364	4	USER	他にキャッシュレス払いができるジャンボタクシーはありませんでしょうか。	general,taxi
4364	5	SYSTEM	申し訳ございません。その条件ですと、ご案内できるところがありませんでした。	general,taxi
4364	6	USER	わかりました。それでは通常のタクシーで結構ですのでキャッシュレス払いが可能なところを教えていただけますか	general,taxi
4364	7	SYSTEM	かしこまりました。そうしますと、五十川タクシー（有）はいかがでしょうか？	general,taxi
4364	8	USER	ありがとうございます。そちらの電話番号を教えていただけますか。	general,taxi
4364	9	SYSTEM	はい、電話番号は、0925012525でございます。	general,taxi
4364	10	USER	ありがとうございます。それではこちらのタクシー会社で予約をお願いしたいと思います。５月１日の１０時５０分です。	general,taxi
4364	11	SYSTEM	かしこまりました。お時間は午前10時50分でよろしかったでしょうか？あと、出発地、目的地もお願いできますでしょうか？	general,taxi
4364	12	USER	出発地は黒豚あじと 福岡赤坂店というところです．目的地は博多の奥座敷 椎原温泉 割烹旅館みはる荘というところまでお願いできますか。	general,taxi
4364	13	SYSTEM	かしこまりました。お時間は午前10時50分発で、ご予約完了いたしました。予約番号は、21731です。	general,taxi
4364	14	USER	ご親切にありがとうございました。こちらで結構です。	general,taxi
4364	15	SYSTEM	こちらこそ、ご利用ありがとうございました。他にお調べすることがないようでしたら、これで失礼いたします。	general,taxi
4364	16	USER	ありがとうございました。	general,taxi
