dialogue_id	turn_id	speaker	utterance	goal_domains
4579	0	USER	札幌の東区でWi-Fiが無料の飲食店はありますか？	general,restaurant,weather
4579	1	SYSTEM	東区でWiFi無料の飲食店といえば、CAFE VOIZ、こちら一択です。	general,restaurant,weather
4579	2	USER	最寄り駅はどこになりますか？	general,restaurant,weather
4579	3	SYSTEM	新道東駅になります。	general,restaurant,weather
4579	4	USER	わかりました。最後に12/6の中央区の天気を教えてください。	general,restaurant,weather
4579	5	SYSTEM	12/6 札幌 中央区 の天気は晴時々曇、最低気温-3.8度、最高気温-0.7度です。	general,restaurant,weather
4579	6	USER	わかりました。ありがとうございました。	general,restaurant,weather
4579	7	SYSTEM	寒さにご注意くださいね。	general,restaurant,weather
