dialogue_id	turn_id	speaker	utterance	goal_domains
4658	0	USER	横浜の宿泊施設を探しています。WIFIと駐車場が無料のところをお願いできますか。	general,hotel,weather
4658	1	SYSTEM	かしこまりました。では、南区エリアにある旅館 松島というところはいかがでしょうか？	general,hotel,weather
4658	2	USER	結構です。そちらのチェックイン開始時刻と最寄り駅と電話番号を教えてください。	general,hotel,weather
4658	3	SYSTEM	チェックインは15時からとなっております。最寄り駅は、蒔田駅です。電話番号は、0457312720でございます。	general,hotel,weather
4658	4	USER	ありがとうございます。当日のお天気が心配です。４月２０日の瀬谷区の最低気温とお天気を教えていただけますか。	general,hotel,weather
4658	5	SYSTEM	はい。当日の最低気温は9.5度、天気は、曇時々晴の予報です。	general,hotel,weather
4658	6	USER	ありがとうございました、お聞きしたいことは以上です。ありがとうございます。	general,hotel,weather
4658	7	SYSTEM	承知いたしました。本日はご利用ありがとうございました。	general,hotel,weather
