dialogue_id	turn_id	speaker	utterance	goal_domains
4694	0	USER	札幌へ旅行するので、東区でレストランのある宿泊施設を探してください。	general,hotel,shopping,restaurant
4694	1	SYSTEM	札幌東区には、レストラン併設の宿泊施設はなさそうです。	general,hotel,shopping,restaurant
4694	2	USER	そうですか。では東区以外でお願いします。	general,hotel,shopping,restaurant
4694	3	SYSTEM	札幌に、レストラン併設の宿泊施設は７３件ありますが、リッチモンドホテル札幌駅前をお勧めします。	general,hotel,shopping,restaurant
4694	4	USER	そこの最寄り駅はなんですか？	general,hotel,shopping,restaurant
4694	5	SYSTEM	札幌駅です。	general,hotel,shopping,restaurant
4694	6	USER	わかりました。4人で11/13から2泊の宿泊予約をお願いします。	general,hotel,shopping,restaurant
4694	7	SYSTEM	予約成功しました。予約番号は41572です。	general,hotel,shopping,restaurant
4694	8	USER	ありがとうございます。北区のショッピングモールも探してもらえます？	general,hotel,shopping,restaurant
4694	9	SYSTEM	札幌北区のショッピングモールは、パセオです。	general,hotel,shopping,restaurant
4694	10	USER	そこにします。近辺の駅からの所要時間はわかります？	general,hotel,shopping,restaurant
4694	11	SYSTEM	札幌駅から徒歩で1分です。	general,hotel,shopping,restaurant
4694	12	USER	わかりました。あと、西区の最寄り駅がロープウェイ入口停留所である飲食店も探してほしいのですが、いいところはありませんか？	general,hotel,shopping,restaurant
4694	13	SYSTEM	西区でロープウェイ入口停留所を満たす飲食店はヒットしません。	general,hotel,shopping,restaurant
4694	14	USER	そうですか。なら西区以外でお願いします。	general,hotel,shopping,restaurant
4694	15	SYSTEM	ロープウェイ入口停留所の飲食店ならば、ふしみグリエ、こちらになります。	general,hotel,shopping,restaurant
4694	16	USER	そうなんですね。定休日と駐車場があるかを教えてもらえますか？	general,hotel,shopping,restaurant
4694	17	SYSTEM	定休日はなし、無料駐車場があります。	general,hotel,shopping,restaurant
4694	18	USER	わかりました。2人で11/13の16:30から予約とれます？	general,hotel,shopping,restaurant
4694	19	SYSTEM	予約成功しました。予約番号は6064です。	general,hotel,shopping,restaurant
4694	20	USER	いろいろありがとうございました。	general,hotel,shopping,restaurant
