dialogue_id	turn_id	speaker	utterance	goal_domains
47	0	USER	こんにちは。京都旅行に行く予定なんですが、いろいろ知りたいことがありまして。	general,restaurant,attraction
47	1	SYSTEM	京都ですね。どのようなことをお知りになりたいですか。	general,restaurant,attraction
47	2	USER	食事処を探してるんですけど、車を無料で停められるお店ってありそうですか？	general,restaurant,attraction
47	3	SYSTEM	８件ございますが、ほかに何か条件はございますか。	general,restaurant,attraction
47	4	USER	左京区の辺で探してもらえたりすると、助かります。	general,restaurant,attraction
47	5	SYSTEM	では稲穂食堂はいかがでしょうか。	general,restaurant,attraction
47	6	USER	そこの営業時間って分かったりします？	general,restaurant,attraction
47	7	SYSTEM	17:00～23:00でございます。	general,restaurant,attraction
47	8	USER	ありがとうございます。あとwifiはあるんですか？	general,restaurant,attraction
47	9	SYSTEM	申し訳ございませんが、Wi-Fiの有無は不明です。	general,restaurant,attraction
47	10	USER	あ、大丈夫です。あと、観光できる場所も探したくて、そっちはwifiが無料で使えるところが良いです。	general,restaurant,attraction
47	11	SYSTEM	その条件ですと国立京都国際会館がございます。	general,restaurant,attraction
47	12	USER	それは何の施設なんですかね？ジャンルで言うと。	general,restaurant,attraction
47	13	SYSTEM	ジャンルはコンサート・ショーとなっております。	general,restaurant,attraction
47	14	USER	そうなんだ。そこは、駐車場はあるんですか？	general,restaurant,attraction
47	15	SYSTEM	有料ですが駐車場ございます。	general,restaurant,attraction
47	16	USER	わかりました。いや、助かりましたよ、ありがとう。	general,restaurant,attraction
47	17	SYSTEM	ほかにご用件はございますか。	general,restaurant,attraction
47	18	USER	はい、もうすっきり解決しました。どうもありがとうございました。	general,restaurant,attraction
47	19	SYSTEM	承知しました。ありがとうございました。	general,restaurant,attraction
