dialogue_id	turn_id	speaker	utterance	goal_domains
479	0	USER	福岡へ旅行したいのですが、宿泊施設はありますか？	general,hotel,attraction,taxi
479	1	SYSTEM	はい、97件ほど、ご案内可能です。なにかご希望の条件はございますでしょうか？	general,hotel,attraction,taxi
479	2	USER	はい。東区で、レストランが併設されていて、Wi-Fiが無料で利用できるところがいいです。	general,hotel,attraction,taxi
479	3	SYSTEM	大変申し訳ございません。その条件では、該当するものがありませんでした。	general,hotel,attraction,taxi
479	4	USER	そうですか。では早良区でお願いできますか？	general,hotel,attraction,taxi
479	5	SYSTEM	ありがとうございます。3件候補がござます。たとえば、ザ・レジデンシャルスイート・福岡というところは如何でしょうか？	general,hotel,attraction,taxi
479	6	USER	そちらでおねがいします。チェックイン開始時刻と料金情報を教えてください。	general,hotel,attraction,taxi
479	7	SYSTEM	チェックイン開始は、15時からとなっております。お値段については、普通の料金設定ということ以外、ご提供出来る情報がございません。申し訳ありません。	general,hotel,attraction,taxi
479	8	USER	了解です。8/27から4泊したいのですが、予約は可能ですか？人数は二人です。	general,hotel,attraction,taxi
479	9	SYSTEM	ご予約ありがとうございます。予約番号65199にて、承りました。	general,hotel,attraction,taxi
479	10	USER	ありがとうございます。続いて東区で科学館の観光名所を探しているのですが、ありますか？	general,hotel,attraction,taxi
479	11	SYSTEM	大変申し訳ございません。その条件では、該当する観光名所がありませんでした。いかがいたしましょうか？	general,hotel,attraction,taxi
479	12	USER	わかりました。では、ジャンルを考慮しないとした場合はどうですか？	general,hotel,attraction,taxi
479	13	SYSTEM	ありがとうございます。そうしますと、マリンワールド 海の中道はいかがでしょうか？ジャンルは、水族館, 美術館・博物館となっております。	general,hotel,attraction,taxi
479	14	USER	そこにします。大人入場料はわかりますか？	general,hotel,attraction,taxi
479	15	SYSTEM	はい。高校生以上の大人入場料は、2350円です。シニアの場合は、1,880円になります。	general,hotel,attraction,taxi
479	16	USER	わかります。当日利用できるジャンボタクシーを利用できて、キャッシュレス払いができるタクシー会社を教えてください。	general,hotel,attraction,taxi
479	17	SYSTEM	申し訳ございません。福岡でジャンボタクシーとキャッシュレス払いの両方に対応している会社は、ご案内できるところがありませんでした。	general,hotel,attraction,taxi
479	18	USER	なるほど。では、キャッシュレス払いができなくても大丈夫です。	general,hotel,attraction,taxi
479	19	SYSTEM	ありがとうございます。では、西日本自動車（株）は如何でしょうか？	general,hotel,attraction,taxi
479	20	USER	そこにします。電話番号を教えてください。	general,hotel,attraction,taxi
479	21	SYSTEM	電話番号は、0570075678です。ご予約も可能ですが、いかがいたしますか？	general,hotel,attraction,taxi
479	22	USER	お願いします。8/27の時間は15:30で予約したいです。	general,hotel,attraction,taxi
479	23	SYSTEM	かしこまりました。ご出発予定地と目的地もお願いできますでしょうか？	general,hotel,attraction,taxi
479	24	USER	はい。出発地が先ほどの宿泊所で、目的地が先ほどの観光施設でお願いします。	general,hotel,attraction,taxi
479	25	SYSTEM	大変申し訳ございません。その条件では、該当するものがありませんでした。	general,hotel,attraction,taxi
479	26	USER	わかりました。では時間を16：20に変更します。	general,hotel,attraction,taxi
479	27	SYSTEM	ありがとうございます。予約を完了いたしました。予約番号は、91835となります。	general,hotel,attraction,taxi
479	28	USER	了解です。ありがとうございます。	general,hotel,attraction,taxi
479	29	SYSTEM	他にお調べすることはございませんか？	general,hotel,attraction,taxi
479	30	USER	大丈夫です！	general,hotel,attraction,taxi
479	31	SYSTEM	承知しました。本日はご利用ありがとうございました。	general,hotel,attraction,taxi
