dialogue_id	turn_id	speaker	utterance	goal_domains
4865	0	USER	福岡に旅行に行こうと思っています。そこで早良区で予算安めで飲食のできるお店を探してください。最寄りは福大前駅がいいです。	general,restaurant,taxi,weather
4865	1	SYSTEM	申し訳ありません、この条件ではご案内ができません。いかが致しましょう？	general,restaurant,taxi,weather
4865	2	USER	では地区の条件はなしでお願いします。	general,restaurant,taxi,weather
4865	3	SYSTEM	ありがとうございます。では、エリアでいうと城南区にある、まいどおおきに食堂城南堤食堂はいかがでしょう？ジャンルは、和食となります。	general,restaurant,taxi,weather
4865	4	USER	ありがとうございます。このお店の住所を教えてください。	general,restaurant,taxi,weather
4865	5	SYSTEM	はい、住所は、福岡県福岡市城南区堤1丁目9-5となります。	general,restaurant,taxi,weather
4865	6	USER	ありがとうございます。あと、タクシーは福岡昭和タクシー（株）を利用しようと思うのですが、電話番号とキャッシュレス対応を教えてもらえますか。	general,restaurant,taxi,weather
4865	7	SYSTEM	はい、電話番号は、0120408860となります。キャッシュレス、ジャンボタクシーともに対応しております。	general,restaurant,taxi,weather
4865	8	USER	ありがとうございます。では、12/23の午前9時30分に警固公園からまいどおおきに食堂城南堤食堂で予約をお願いします。	general,restaurant,taxi,weather
4865	9	SYSTEM	承知しました。予約が完了し、ご予約番号は、68837となります。	general,restaurant,taxi,weather
4865	10	USER	ありがとうございます。あと、12/23の早良区の最高気温は何度になりますか。	general,restaurant,taxi,weather
4865	11	SYSTEM	はい、最高気温は15度となります。	general,restaurant,taxi,weather
4865	12	USER	ありがとうございます。これで大丈夫です。	general,restaurant,taxi,weather
4865	13	SYSTEM	ありがとうございました。	general,restaurant,taxi,weather
