dialogue_id	turn_id	speaker	utterance	goal_domains
585	0	USER	こんにちは！札幌へ旅行に行くんですが、北区で泊まれるところを教えてください。	general,hotel,restaurant,shopping
585	1	SYSTEM	かしこまりました。5件ほどご案内可能です。たとえば、東横INN札幌駅北口というビジネスホテルはいかがでしょうか？	general,hotel,restaurant,shopping
585	2	USER	Wi-Fiが無料で、レストランが併設されているところがいいんですが、そちらはどうですか？	general,hotel,restaurant,shopping
585	3	SYSTEM	大変申し訳ございません。その条件ですと、ご案内できるところが見つかりませんでした。	general,hotel,restaurant,shopping
585	4	USER	ではレストランが併設されているところは無しで大丈夫です。	general,hotel,restaurant,shopping
585	5	SYSTEM	ありがとうございます。では、さきほどご案内した、東横INN札幌駅北口は、どうでしょうか？お値段は安めのビジネスホテルです。	general,hotel,restaurant,shopping
585	6	USER	近辺の駅からの所要時間は分かりますか？	general,hotel,restaurant,shopping
585	7	SYSTEM	さっぽろ駅から徒歩で1分、札幌駅からは徒歩3分の距離となっております。	general,hotel,restaurant,shopping
585	8	USER	いいですね！ではそちらで10/19に予約をお願いします。4人で4泊します！	general,hotel,restaurant,shopping
585	9	SYSTEM	かしこまりました。予約が完了いたしました。ご予約番号は、74750です。	general,hotel,restaurant,shopping
585	10	USER	ありがとうございます。食事ができる飲食店も探して欲しいんですが、洋食・西洋料理が食べられるところはありますか？	general,hotel,restaurant,shopping
585	11	SYSTEM	はい、19件ほどご案内可能です。たとえば、円山別邸というお店がございますが、いかがでしょうか？	general,hotel,restaurant,shopping
585	12	USER	予算は安めがいいんですが、どうですか？	general,hotel,restaurant,shopping
585	13	SYSTEM	大変申し訳ございません。その条件ですと、ご案内できるところが見つかりませんでした。	general,hotel,restaurant,shopping
585	14	USER	わかりました！では普通の予算でも大丈夫です！	general,hotel,restaurant,shopping
585	15	SYSTEM	ありがとうございます。では、中央区エリアにある、オリゾンテというお店はいかがでしょうか？	general,hotel,restaurant,shopping
585	16	USER	いいですね！電話番号を教えてください。	general,hotel,restaurant,shopping
585	17	SYSTEM	電話番号は、0112220021でございます。ご予約もいたしますか？	general,hotel,restaurant,shopping
585	18	USER	予約はまだ大丈夫です。中央区で買い物ができるところはありますか？	general,hotel,restaurant,shopping
585	19	SYSTEM	はい、23件ほどご案内可能です。なにかご希望の条件など、ございませんか？	general,hotel,restaurant,shopping
585	20	USER	駐車場が無料のところがいいです！	general,hotel,restaurant,shopping
585	21	SYSTEM	では、ポケモンセンターサッポロはいかがでしょうか？	general,hotel,restaurant,shopping
585	22	USER	ジャンルは何になりますか？	general,hotel,restaurant,shopping
585	23	SYSTEM	ジャンルは、文房具・雑貨, おもちゃ, お土産、となっております。	general,hotel,restaurant,shopping
585	24	USER	なるほど！最寄り駅と営業時間についても教えてください。	general,hotel,restaurant,shopping
585	25	SYSTEM	最寄りは札幌駅です。駅から徒歩1分でアクセスできます。営業時間は、10:00～20:00です。	general,hotel,restaurant,shopping
585	26	USER	ありがとうございます。	general,hotel,restaurant,shopping
585	27	SYSTEM	他にお調べすることはございませんか？	general,hotel,restaurant,shopping
585	28	USER	はい！色々とありがとうございました。	general,hotel,restaurant,shopping
585	29	SYSTEM	承知いたしました。本日はご利用ありがとうございました。	general,hotel,restaurant,shopping
