dialogue_id	turn_id	speaker	utterance	goal_domains
735	0	USER	仙台の勾当台公園駅近くで、無料Wi-Fiが利用できる観光名所を探しているんですが、どこかありますか？	general,attraction,hotel,weather
735	1	SYSTEM	はい、1件ご案内できます。エル・パーク仙台というところですが、いかがでしょうか？	general,attraction,hotel,weather
735	2	USER	そちらは近くの駅からどのくらいかかりますか？	general,attraction,hotel,weather
735	3	SYSTEM	最寄りの勾当台公園駅から徒歩で1分ほどです。	general,attraction,hotel,weather
735	4	USER	ありがとうございます。当日泊まれるところも探していて、無料で駐車場が利用できるところがいいのですが。	general,attraction,hotel,weather
735	5	SYSTEM	申し訳ございません。その条件ですと、ご案内できるところが見つかりませんでした。	general,attraction,hotel,weather
735	6	USER	無料駐車場がなくても構わないので、どこかありませんか？	general,attraction,hotel,weather
735	7	SYSTEM	かしこまりました。そうしますと、ホテルJALシティ仙台というシティホテルは如何でしょうか？こちらでしたら、駐車場は有料ですが、ご利用いただけます。	general,attraction,hotel,weather
735	8	USER	ありがとうございます。そのホテルの値段帯とレストランがあるかどうか教えてもらえますか？	general,attraction,hotel,weather
735	9	SYSTEM	値段帯は、お安めとなっております。レストランも、併設しております。	general,attraction,hotel,weather
735	10	USER	２月２５日から２泊で、人数は４人で予約お願いできますか？	general,attraction,hotel,weather
735	11	SYSTEM	大変申し訳ございません。ご希望の条件では予約をおとりできませんでした。いかがいたしましょうか？	general,attraction,hotel,weather
735	12	USER	人数を３人にしたらどうでしょうか？	general,attraction,hotel,weather
735	13	SYSTEM	ありがとうございます。3名様でご予約完了いたしました。予約番号は、24618です。	general,attraction,hotel,weather
735	14	USER	ありがとうございました。あと、２月２５日の青葉区の最低気温と最高気温も教えてほしいです。	general,attraction,hotel,weather
735	15	SYSTEM	かしこまりました。当日の最低気温はマイナス3度、最高気温は4.2度の予想です。なお、天気は雨のち晴れの予報となっております。	general,attraction,hotel,weather
735	16	USER	ありがとうございました。	general,attraction,hotel,weather
735	17	SYSTEM	他にお調べすることはございませんか？	general,attraction,hotel,weather
735	18	USER	はい、大丈夫です。ありがとうございました。	general,attraction,hotel,weather
735	19	SYSTEM	承知いたしました。では、本日はご利用ありがとうございました。	general,attraction,hotel,weather
