dialogue_id	turn_id	speaker	utterance	goal_domains
857	0	USER	東京で買い物をしたいのですが、駐車場が無料で使える百貨店や総合スーパーはありますか？	general,shopping
857	1	SYSTEM	はい、6件ご案内可能です。例えば、中央区エリアにある、銀座三越というお店はいかがでしょうか？	general,shopping
857	2	USER	そちらは、最寄り駅が本郷３丁目駅になりますか？	general,shopping
857	3	SYSTEM	いいえ、最寄りは東銀座駅となっております。本郷３丁目駅の近くでお探ししましょうか？	general,shopping
857	4	USER	そうなのですね。でも銀座三越でかまいません。定休日と営業時間、電話番号を教えてください。	general,shopping
857	5	SYSTEM	銀座三越ですと、定休日はございません。営業時間は、10:00～20:00です。電話番号は、0335621111でございます。	general,shopping
857	6	USER	調べたいことは以上です。ありがとうございました。	general,shopping
857	7	SYSTEM	承知いたしました。本日はご利用ありがとうございました。	general,shopping
